{
  "id": "2026-05-11_hormuz_iran_x",
  "date": "2026-05-11",
  "story_key": "hormuz_iran",
  "target_platform": "x",
  "draft_kind": "thread",
  "draft_path": "drafts/2026-05-11_hormuz_iran_thread.json",
  "stage_status": "pending",
  "staged_at": "2026-05-11T16:34:57Z",
  "approved_at": null,
  "approved_by": null,
  "meta_version": "8.7.0"
}
